NAME,TEAM,CATEGORY,WT. CLASS,BODY WT.,BEST SQ,BEST BP,BEST DL,TOTAL,IPF GL
"Tabuan, Jessa Mae V.",ZPG,W - O,47,46.85,90,60,120,270,75.08252397
"Esperanza, Raycel E.",IND,W - O,47,46.15,70,32.5,97.5,200,56.46568756
"Villasica, Shiela Mae M.",IND,W - O,52,50.3,110,55,135,300,77.99692857
"Liongson, Eivy Claire DG",FNB A,W - O,52,51.9,57.5,27.5,60,145,36.67420477
"Savillo, Angelica P.",MAYHEM,W - O,57,56.8,142.5,87.5,130,360,84.66707294
"Bautista, Jeremy Reign R.",ZPG,W - O,57,55.3,110,85,150,345,82.82636277
"Salas, Ellyssa Marie S.",POPFIT,W - O,57,53.25,105,70,132.5,307.5,76.10656852
"Dacumos, Pearl Maria Andrea P.",MTFC,W - O,57,54.7,87.5,35,100,222.5,53.87965777
"Salonga, Anne Jehiel S.",FNB A,W - O,57,52.75,62.5,27.5,65,155,38.66582579
"Alejandro, Christine Erine A.",IND,W - O,63,61.55,125,70,170,365,81.08436723
"Sto Tomas, Gladys, D.",POPFIT,W - O,63,61.1,110,52.5,140,302.5,67.5319291
"Pascual, Sonia C.",IND,W - O,63,61.2,110,60,130,300,66.90000198
"Regalado, Katherine P.",ES,W - O,63,61.7,115,45,132.5,292.5,64.87326765
Maria Michaela Mizal,FNB A,W - O,69,67.05,110,50,125,285,60.01632217
"Cruz, Esmeralda Alegria, M.",ZPG,W - O,69,68.8,92.5,45,122.5,260,53.95234272
"Samson, Lara Mae M.",FNB A,W - O,69,66.05,70,30,102.5,202.5,43.02299599
"Galvan, Shayne, V.",IND,W - O,76,74.65,105,52.5,110,267.5,53.19361232
"Washington, Tanya T.",FNB A,W - O,76,74.85,82.5,37.5,102.5,222.5,44.18777448
"Tugade, Charlene Ayen C.",BC,W - O,84,77.25,152.5,67.5,177.5,397.5,77.7785568
"Buenconsejo, Clara, A",MAYHEM,W - O,84,83.95,102.5,60,130,292.5,55.25109199
"Tugade, Charlene Ayen C.",Adventist,W - C,84,77.25,152.5,67.5,177.5,397.5,77.7785568
"Piedad, Bea, C.",MAYHEM,W - O,84+,99.2,135,72.5,147.5,355,63.45110367
"Tabuan, Jessa Mae V.",JRU,W - HS,47,46.85,90,60,120,270,75.08252397
"Narral, Khieszia Danielle",CMG,G - D,35,34.3,55,27.5,77.5,160,65.90543031
"Perillo, Adrian Josef A.",MTFC,M - O,59,58.7,140,100,205,445,73.83685476
"Ojas, Johnry, C.",IND,M - O,59,58.4,140,70,155,365,60.72927032
"Valencia, Rico Adrienne. D",POPFIT,M - O,59,57.25,130,72.5,160,362.5,60.95989042
"Rodriguez, Mark Joseph A.",CAVITE,M - O,59,55.95,120,72.5,162.5,355,60.43940029
"Domingo, Dominic Arthur Ancaja",IND,M - O,59,58.6,122.5,80,150,352.5,58.54218262
"Juico, Luigi Miguel S.",POPFIT,M - O,59,58.05,105,82.5,150,337.5,56.33496162
"Trinidad, Philip Lawrence R.",ZPG,M - O,59,57.75,105,65,130,300,50.21481354
"Casamayor, Aeron Paul S.",KINETIX,M - O,59,55.05,170,90,,,
"Mendoza, Jose Javier V.",IND,M - O,66,63.2,195,115,200,510,81.35022655
"Dimzon, Melvin C.",IND,M - O,66,63.45,182.5,105,202.5,490,77.99612439
"Escala, Kurt Christian A.",IND,M - O,66,66,180,92.5,195,467.5,72.87587426
"Ralar, Jericho C.",FNB A,M - O,66,63.95,170,90,185,445,70.53840459
"Javier, Ramil, V.",IND,M - O,66,64.7,142.5,82.5,207.5,432.5,68.13406506
"Diamse, Rozano R.",POPFIT,M - O,66,64.3,140,97.5,185,422.5,66.77806327
"Cacabelos, Axel John Eric, A.",MAYHEM,M - O,66,65.6,145,90,175,410,64.11845955
"Gongora, Carl Angelo C.",ES,M - O,66,65.1,150,90,170,410,64.37882464
"Bautista, Stanley Steven C.",POPFIT,M - O,66,63.55,150,90,165,405,64.41224391
"Pascual, Christian Joyce A.",POPFIT,M - O,66,62.35,135,92.5,162.5,390,62.65894383
"Hayudini, Lois Clark",IND,M - O,66,64.3,125,85,172.5,382.5,60.45587976
"Bernal, Donn Esbert, S.",MAYHEM,M - O,74,72.3,220,135,272.5,627.5,93.24339006
"Siquian, Robert Luis T.",IND,M - O,74,73.16,216,140,240,596,88.0191055
"Wales, Eric John",BC,M - O,74,73.4,195,130,240,565,83.29898133
"Valeroso, David Loyd D.",IND,M - O,74,72.85,200,112.5,212.5,525,77.70508002
"Ocampo, Marco Angelo, D.",MAYHEM,M - O,74,70.9,180,117.5,215,512.5,76.93647748
"Cordero, Rodolfo Scottie, A.",IND,M - O,74,73.65,180,112.5,207.5,500,73.58580687
"Milaor, Mark William B.",IND,M - O,74,73.7,185,115,195,495,72.82427787
"De Villa, Isaac",BC,M - O,74,67.1,180,102.5,205,487.5,75.33278764
"Castillo, Quinn H.",MTFC,M - O,74,71.8,190,100,195,485,72.32991094
"Galon, Angelo Miguel C.",IND,M - O,74,73.95,180,105,200,485,71.22775707
"Pascual, Karl Alexis M.",POPFIT,M - O,74,72.9,160,105,190,455,67.32036028
"Romo, XRJ Steven A.",IND,M - O,74,73.15,167.5,85,200,452.5,66.83133672
"Gabres, Dave Anthony",POPFIT,M - O,74,71.9,150,100,200,450,67.06150515
"Torres, Merwin",FNB B,M - O,74,73.25,155,125,155,435,64.2010773
"Miranda, Charles Ervin R.",FNB A,M - O,74,72.6,150,100,175,425,63.01679522
"Ventura, Ruren Gave P.",POPFIT,M - O,74,73,150,80,190,420,62.09756316
"Dalumpines, Psalm Jemuel, Q.",IND,M - O,74,72.35,142.5,85,160,387.5,57.55983683
"Sison, Rahnel Carlo, B.",IND,M - O,74,73.15,120,65,132.5,317.5,46.89270587
"Galauran, Mark Jason",IND,M - O,83,82.3,215,150,250,615,85.49772893
"Calingacion, Arjay Azuela",BARS,M - O,83,81.55,202.5,132.5,242.5,577.5,80.65784111
"Chiang, Christopher Y.",MAYHEM,M - O,83,81.9,195,130,230,555,77.34714576
"Fernandez, Habagat Viktor Hamin Grace A.",UP,M - O,83,80.5,215,100,227.5,542.5,76.27022799
"Abat, Quintin III S.",IND,M - O,83,80.3,182.5,145,210,537.5,75.66307132
"Pingol, Miguel Marcus G.",MAYHEM,M - O,83,80.9,185,127.5,195,507.5,71.16985327
"Catamora, Omar Radam",IND,M - O,83,82.15,180,112.5,215,507.5,70.61820583
"Escalona, Anthony Brien",IND,M - O,83,80.8,167.5,115,220,502.5,70.51301306
"Dy, Mark Ranielle",IND,M - O,83,81.7,190,110,185,485,67.67549648
"Mizal, Renz Nikko D.",FNB A,M - O,83,77.3,160,110,205,475,68.1807938
"Japlos, Jose Gabriel, L.",IND,M - O,83,75.7,152.5,127.5,187.5,467.5,67.83135572
"Libo, Martin",IND,M - O,83,81.25,162.5,107.5,180,450,62.9679744
Janorabon Carlos S.,POPFIT,M - O,83,82.15,150,95,185,430,59.83414484
"De Jesus, Cody Jericho Miguel G.",IND,M - O,83,79.9,215,,,,
"Redulla, Nestor Jr, A.",IND,M - O,93,92.2,275,147.5,300,722.5,94.91802825
"Espedido, Lance Fredrick D.",POPFIT,M - O,93,90.55,222.5,142.5,247.5,612.5,81.18304709
"Andrade, Jeb S.",MAYHEM,M - O,93,88.65,212.5,122.5,227.5,562.5,75.34077372
Rodriguez Gerald Louie R.,IND,M - O,93,91.25,182.5,125,250,557.5,73.61395582
"Lazatin, Seb, Y.",MAYHEM,M - O,93,89.85,212.5,130,200,542.5,72.18050368
"Scarlata, Filippo, T.",MAYHEM,GUEST,93,91.4,180,150,205,535,70.58606446
"Salvador, Pios Ives",IND,M - O,93,86.25,165,107.5,185,457.5,62.11978098
"Legaspi, Enrico Daniel R.",IND,M - O,93,84.7,155,90,200,445,60.97395077
"Singh, Harvinder",IND,M - O,93,90.45,157.5,95,185,437.5,58.01944131
"Lim, Justin Quincy, B.",IND,M - O,93,93,135,77.5,152.5,365,47.7497169
"Cahilig, Rafael Renzo, S.",IND,M - O,120,119.25,310,190,275,775,90.33772358
"Teodosio, Ross Emanuel M.",BARS,M - O,120,119,280,162.5,265,707.5,82.54541836
"Laureta, Jose Antonio, M.",MAYHEM,M - O,120,106.5,192.5,122.5,210,525,64.39355181
"De Joya, Mark Alexander M.",IND,M - O,120,110.65,180,115,217.5,512.5,61.76818021
"Paredes, Armand L.",IND,M - O,120,114.15,192.5,100,215,507.5,60.31238253
"Caparas, Aldrin J.",ZPG,M - O,120,118.5,170,130,200,500,58.44381815
"Buenafe, Jeremiah R.",ZPG,M - O,120,112.7,165,107.5,220,492.5,58.86671856
"Pastor, George Carlos H.",ES,M - O,120,111,185,95,210,490,58.97176947
"Yonzon, Noel Lucky O.",IND,M - O,120+,120.5,250,160,250,660,76.58347547
"Alcober, Vicente Paolo D.",ZPG,M - O,120+,129.7,227.5,127.5,257.5,612.5,68.87763729
"Funtanilla, John Daniel T.",IND,M - O,120+,127.55,,,,,
"Laquian, Lance Gabriel, V.",UST,M - C,59,58,167.5,90,182.5,440,73.47802943
"Feleo, Joeshua Kennedy B.",OLFU,M - C,59,57.1,130,75,175,380,63.99279928
"Gongora, Carl Angelo C.",OLFU,M - C,66,65.1,150,90,170,410,64.37882464
"Bildan, Justin Rey, N",TSU,M - C,66,65.1,135,87.5,185,407.5,63.98627083
"Bautista, Stanley Steven C.",TSU,M - C,66,63.55,150,90,165,405,64.41224391
"Pascual, Christian Joyce A.",TSU,M - C,66,62.35,135,92.5,162.5,390,62.65894383
"Abdao, Robert Diel, L.",UP,M - C,74,70.85,200,112.5,222.5,535,80.34382016
"Tiu, Ervin Jaeson Yu",DLSU,M - C,74,72.95,172.5,105,223,500.5,74.02598071
"Pangan, Samuel John Q.",OLFU,M - C,74,72.6,170,122.5,207.5,500,74.13740614
"Salonga, Ivan H.",SSC-R,M - C,74,72.3,165,110,210,485,72.0685963
"Lerer, David B.",ADMU,M - C,74,72.4,145,110,212.5,467.5,69.41816247
"Macatangay, Paolo S.",UC,M - C,74,72.7,115,72.5,145,332.5,49.26604974
"Fernandez, Habagat Viktor Hamin Grace A.",MAYHEM,M - C,83,80.5,215,100,227.5,542.5,76.27022799
"Dare, Marc Angelo",FEU-NRMF,M - C,83,80.65,190,110,235,535,75.14456209
"Cauan, Ric Javierson C.",NEU,M - C,83,80.9,190,115,195,500,70.11808203
"Equila, Wesley Roi C.",AMA,M - C,93,90.9,200,125,262.5,587.5,77.72183361
"Cruz, Jalen Cytienne L.",NU,M - C,93,90.85,210,115,247.5,572.5,75.09629338
"Cabana, Benjamin III, M.",DLSU,M - C,93,92.2,215,137.5,220,572.5,75.21186322
"Yumul, Ed Aaron B.",AIAC,M - C,93,91.35,165,115,225,505,66.64586035
"Garcia, John Emmanuel S.",OLFU,M - C,93,86.9,160,105,175,440,59.52015946
"Florendo, Emilio Lorenzo Simeon",UP,M - C,105,100.65,267.5,142.5,280,690,86.89974819
"Esmundo, Rhodison Jay P.",NEU,M - C,105,105.7,212.5,135,230,577.5,71.0807646
"Tigranes, Cyril Joshua S.",EAC,M - C,105,103.45,200,92.5,220,512.5,63.71627297
"Teodosio, Ross Emanuel M.",TIP,M - C,120,119,280,162.5,265,707.5,82.54541836
"Sy, John Carl T.",PUP,M - C,120+,125.3,170,100,220,490,55.90937925
"Cruz, Ezrael S.",IND,B - D,53,52,50,22.5,55,127.5,22.57925803
"Angeles, Xandro Vito O.",LSGH,M - HS,59,56.6,135,100,150,385,65.14160262
"Trinidad, Philip Lawrence R.",STJOHN,M - HS,59,57.75,105,65,130,300,50.21481354
"Dayao, Cirilo III, M.",UE,M - HS,59,55.95,95,55,115,265,45.11673543
Cristobal Amir P.,NNHS,M - HS,66,61.4,135,77.5,175,387.5,62.7689159
"Ventura, Ruren Gave P.",DBTC,M - HS,74,73,150,80,190,420,62.09756316
Janorabon Carlos S.,DBTI,M - HS,83,82.15,150,95,185,430,59.83414484
"Bernarte, Bryan Nicole S.",STI,M - HS,83,76.55,142.5,85,185,412.5,59.50747045
"Guiao, Naple Alexander Sapon",CHS,M - HS,83,82.55,160,85,160,405,56.21703291
"Basco, Ralph Victor B.",CEU-IS,M - HS,83,82.15,140,80,170,390,54.26817788
